14,0,UNITED ARROWS green label relaxing ◆FFC アンゴラビーバー スリット ノーカラー コート ユナイテッドアローズ グリーンレーベルリラクシング コート/ジャケット コート/ジャケットその他 グレー ブラック ホワイト ブラウン【送料無料】,UNITED ARROWS green label relaxing レディース コート/ジャケット ユナイテッドアローズ グリーンレーベルリラクシング,stylife:12714305,29700,"UNITED ARROWS green label relaxing（ユナイテッドアローズ グリーンレーベルリラクシング）◆FFC アンゴラビーバー スリット ノーカラー コート◆greenlabelrelaxingの新定番！着回しノーカラーコート◆〜お客様の声を取り入れて開発したこだわりアウター〜ご大好評のON/OFF兼用コートが今年も登場しました！様々なシーンにマッチするコートをテーマにお客様と共に開発したロング丈デザインです。【デザイン】女性らしい上品なノーカラーデザイン。フロントはワンホックで留める仕様にし、シンプルに仕上げました。サイドの深めスリットがスタイリングに抜け感をプラス♪また袖のタブディテールが全体のアクセントになっています。【カラー】今年はカラーをアップデート！ベーシックに着回せるブラックに加え、ナチュラルさを感じさせるオートミール(ナチュラルカラー)、甘すぎないライトグレー、ベイクドブラウンカラー、ダークグレーと、ニュアンス感にこだわってお作りしました。【素材】しなやかで落ち感のあるアンゴラ混のダブルビーバー素材。しっかりとした厚みがありながら、毛足のある表情が特徴です。【重量：約1325g(サイズ：38)】※商品の重量に関して※こちらはサンプル(サイズ：38)を計測しております。掲載の重さは目安として、参考にして下さい。こちらは同デザインで、H148-155cmの小柄な方に向けて開発したXSサイズ展開（品番:3625-147-1726）もございます。----------------------------------推奨着用シーズン：秋(後半)〜冬ケア方法：ドライクリーニング裏地：あり----------------------------------[着用コメント：スタッフ藤野(モカメイン)]年齢:20代後半/身長:152cm/体型:普通/普段サイズ:34〜36/着用サイズ:XS/骨格タイプ:ナチュラル着丈：膝下丈袖丈：手首にかかるくらい肩幅：肩から肘まで3分の1くらいの位置素材感：しなやかで毛足の表情感があるコメント：トレンドのオーバーサイズアウターを着てみたい気持ちはありましたが、とても大きく子供っぽく見えてし　　36251471691-11-10 BK9846【採寸】34:着丈97 肩幅50.8 バスト99.6 そで丈49 そで周り41.536:着丈97 肩幅51.8 バスト102.6 そで丈50 そで周り42.338:着丈99 肩幅52.8 バスト105.6 そで丈51 そで周り4340:着丈99 肩幅53.8 バスト108.6 そで丈52 そで周り43.842:着丈101 肩幅54.8 バスト111.6 そで丈53 そで周り44.544:着丈101 肩幅55.3 バスト119.6 そで丈53 そで周り49.3商品のサイズについて【商品詳細】中国製素材：表生地;羊毛82% アンゴラ18% 裏生地;ポリエステル100%サイズ：34、36、38、40、42、44※画面上と実物では多少色具合が異なって見える場合もございます。ご了承ください。商品のカラーについて 【予約商品について】 ※「先行予約販売中」「予約販売中」をご注文の際は予約商品についてをご確認ください。 ■重要なお知らせ※ 当店では、ギフト配送サービス及びラッピングサービスを行っておりません。ご注文者様とお届け先が違う場合でも、タグ（値札）付「納品書 兼 返品連絡票」同梱の状態でお送り致しますのでご了承ください。 ラッピング・ギフト配送について※ 2点以上ご購入の場合、全ての商品が揃い次第一括でのお届けとなります。お届け予定日の異なる商品をお買い上げの場合はご注意下さい。お急ぎの商品がございましたら分けてご購入いただきますようお願い致します。発送について ※ 買い物カートに入れるだけでは在庫確保されませんのでお早めに購入手続きをしてください。当店では在庫を複数サイトで共有しているため、同時にご注文があった場合、売切れとなってしまう事がございます。お手数ですが、ご注文後に当店からお送りする「ご注文内容の確認メール」をご確認ください。ご注文の確定について ※ Rakuten Fashionの商品ページに記載しているメーカー希望小売価格は、楽天市場「商品価格ナビ」に登録されている価格に準じています。 商品の価格について UNITED ARROWS green label relaxingUNITED ARROWS green label relaxingのコート/ジャケットその他コート/ジャケットアウターご注文・お届けについて発送ガイドラッピンググッズギフト配送NG3,980円以上送料無料ご利用ガイドよくあるご質問",https://item.rakuten.co.jp/stylife/bk9846/,,1,https://thumbnail.image.rakuten.co.jp/@0_mall/stylife/cabinet/item/846/bk9846-07_1.jpg?_ex=64x64,https://thumbnail.image.rakuten.co.jp/@0_mall/stylife/cabinet/item/846/bk9846-07_1.jpg?_ex=64x64,https://thumbnail.image.rakuten.co.jp/@0_mall/stylife/cabinet/item/846/bk9846-07_1.jpg?_ex=64x64,https://thumbnail.image.rakuten.co.jp/@0_mall/stylife/cabinet/item/846/bk9846-07_1.jpg?_ex=128x128,https://thumbnail.image.rakuten.co.jp/@0_mall/stylife/cabinet/item/846/bk9846-07_1.jpg?_ex=128x128,https://thumbnail.image.rakuten.co.jp/@0_mall/stylife/cabinet/item/846/bk9846-07_1.jpg?_ex=128x128,1,0,0,1,0,0,,0,,,8.0,,,2,2.5,1,,,Rakuten Fashion,stylife,https://www.rakuten.co.jp/stylife/,555087
15,0,★SNSで話題沸騰中★ 洗えるニット ニット レディース ニットワンピース 長袖 [ ワンピース / チュニック / トップス ]カシミアタッチニット [N555] セーター 低刺激 スーツ ボートネック Vネック タートルネック【入荷済】【送料無料】,,mobacaba:10019824,1590,販売数100万枚を突破した、ロングセラー商品が今季大幅リニューアル。洗えるカシミアタッチニットは100パターン以上のバリエーションから選べ、あなただけの1枚がきっと見つかるセミオーダーニットです。【素材・サイズ感】まるでカシミアの様なふんわりした肌触りのニット。ご自宅で洗濯してもピリングが起きにくく、さらには静電気を帯電させない特殊テープを加えたことで、よりデイリーに着て頂きやすくなりました◎今季から新しくボートネックが追加され、選べる3丈・3ネックが嬉しい。※キャンセル/変更不可,https://item.rakuten.co.jp/mobacaba/n555/,,1,https://thumbnail.image.rakuten.co.jp/@0_mall/mobacaba/cabinet/img_n501-n600/n555_750.jpg?_ex=64x64,https://thumbnail.image.rakuten.co.jp/@0_mall/mobacaba/cabinet/img_n501-n600/n555_750.jpg?_ex=64x64,https://thumbnail.image.rakuten.co.jp/@0_mall/mobacaba/cabinet/img_n501-n600/n555_750.jpg?_ex=64x64,https://thumbnail.image.rakuten.co.jp/@0_mall/mobacaba/cabinet/img_n501-n600/n555_750.jpg?_ex=128x128,https://thumbnail.image.rakuten.co.jp/@0_mall/mobacaba/cabinet/img_n501-n600/n555_750.jpg?_ex=128x128,https://thumbnail.image.rakuten.co.jp/@0_mall/mobacaba/cabinet/img_n501-n600/n555_750.jpg?_ex=128x128,1,0,0,1,0,0,,0,,,8.0,,,17092,4.06,1,,,神戸レタス （KOBE LETTUCE）,mobacaba,https://www.rakuten.co.jp/mobacaba/,566028
16,0,≪期間限定！クーポンご利用で1000円OFF≫羽織るだけでスタイリングが際立つ。大人のオシャレ完成形コート SC/M/Lサイズ [近藤千尋さん着用][低身長向けSサイズ有]ダブルフェイス軽量ガウンコート レディース/[2020秋冬新作][先行予約受注],[アウターコレクション][HOTITEM],galstar:10077141,5998,ブラック 黒色 ホワイト 白色 アイボリー ブラウン 茶色 ブルー 青色 SCサイズ Mサイズ Lサイズ コート アウター ロング丈 ガウンコート コーディガン ダブルフェイス オーバーサイズ ビッグシルエット 軽い 軽量 チェスターコート SCサイズ 低身長向けSサイズ対応 星怜奈さん着用羽織るだけでスタイリングが際立つ。大人のオシャレ完成形コートSC/M/L [近藤千尋さん着用][低身長向けSサイズ有]ダブルフェイス軽量ガウンコートコート アウター ロング丈 ガウンコート コーディガン ダブルフェイス オーバーサイズ ビッグシルエット 軽い 軽量 チェスターコート SCサイズ 低身長向けSサイズ対応 星怜奈さん着用[リエディオリジナル][2020秋冬新作]＞コーディネートチェック＞コーディネートチェック＞コーディネートチェック＞コーディネートチェック＞コーディネートチェック＞コーディネートチェック＞コーディネートチェックCOORDINATEこのコーデをCHECKこのコーデをCHECKこのコーデをCHECKこのコーデをCHECKこのコーデをCHECKこのコーデをCHECK商品説明羽織るだけでスタイリングが際立つ。大人のオシャレ完成形コート羽織るだけで旬のスタイリングが完成する、洗練された大人のダブルフェイスガウンコート。リラクシーなビッグシルエットが、ゆったり華奢見えを叶えます。360度どこから見ても、美しく見えるよう、絶妙なサイジングとバックスタイルや横から見た際のシルエットにもこだわりました。2枚の生地の表裏を貼り合わせたダブルフェイス生地は肌触りが良く、暖かいのにとても軽い着心地なのが特徴です。軽量なのでガウン感覚で羽織って、ロングシーズン着用いただけます。ウエストベルトは両サイドのポケットにINすると、よりトレンドライクな着こなしに。■C（コンパクト）サイズ対応身長150〜155cmくらいの方でもバランスよく着ていただける丈感のリエディオリジナルサイズです。※カートボタンには　SC、MC、LC　と記載がございます。素材・着用感2枚の生地の表裏を貼り合わせ1枚の生地にしたダブルフェイス生地。暖かく軽い着心地が特徴です。※生産時期により、仕様が異なる場合がございますスタッフ身長別コメントSCサイズ着用makiko152cm/43kgウエスト：62cmヒップ：85cmわたり：45cm体型：細身で小柄普通のサイズ：XS/Sサイズ丈感スネが隠れるくらいの丈感です。首周りガウンタイプですっきりとしています。胸周りゆとりがあります。袖長さ手の甲が隠れるくらいの丈感です。二の腕周り中肉のニットを着用してもゆとりがあります。どのサイズを選ぶか普段通りSCサイズを選びます。コメント軽い羽織り心地で程よくオーバーサイズながらきちんと感を出してくれるデザインです。中にニットを着用することもできるので、真冬以外は活躍しそうです。サイズ別スタッフ着用コメント掲載中全サイズのコメントをチェック,https://item.rakuten.co.jp/galstar/133443/,,1,https://thumbnail.image.rakuten.co.jp/@0_mall/galstar/cabinet/item/1334/133443_r1_umy.jpg?_ex=64x64,https://thumbnail.image.rakuten.co.jp/@0_mall/galstar/cabinet/item/1334/133443_r1_umy.jpg?_ex=64x64,https://thumbnail.image.rakuten.co.jp/@0_mall/galstar/cabinet/item/1334/133443_r1_umy.jpg?_ex=64x64,https://thumbnail.image.rakuten.co.jp/@0_mall/galstar/cabinet/item/1334/133443_r1_umy.jpg?_ex=128x128,https://thumbnail.image.rakuten.co.jp/@0_mall/galstar/cabinet/item/1334/133443_r1_umy.jpg?_ex=128x128,https://thumbnail.image.rakuten.co.jp/@0_mall/galstar/cabinet/item/1334/133443_r1_umy.jpg?_ex=128x128,1,0,1,1,0,0,,0,,,8.0,2020-11-30 15:00,2020-12-02 00:59,19,4.16,1,,,Re：EDIT（リエディ）,galstar,https://www.rakuten.co.jp/galstar/,555087
17,0,クーポン利用で2390円！ 楽天1位 プリーツスカート ロング 秋冬 スエード スカート プリーツ 5色 冬 スウェード レディース スウェードスカート ロングスカート マキシスカート フレアスカート フェイクスエード 裏地付き ウエストゴム シンプル 無地 メール便可//10//,SNSで話題騒然!!フェイクスエードプリーツスカート！,kira-kira:10017004,3480,ディティールカラースペックSpec商品説明●全7色！スウェードロングプリーツスカート●1点投入でシーズンライクな着こなしが完成するスウェードスカート。●着回しやすいシンプルなデザインで、きれいめにもカジュアルにも活躍する1枚◎●立体的な縦ラインが表情豊かなプリーツ仕立て。綺麗に波打つヒダが華やかで、女性らしく洗練された雰囲気に。●ストンと流れるロングシルエット。広がり過ぎない上品なシルエットが、大人めにもカジュアルにも着回しやすいポイント。●ウエストは楽ちんな平ゴム一周仕様。●表地：温かみのあるスウェード調生地。秋冬らしさがありながらも、重たく見せない柔らかな風合いが魅力◎●裏地：しなやかでさらりとした薄手エステル生地。伸縮性抜群で、動きを妨げずノンストレスな着用感。※MADE IN CHINA(中国製)カラーベージュ、ダストピンク、ブラウン、チャコール、ブラック、ライトダストピンク、クリーム素材表地：ポリエステル100％裏地：ポリエステル100％サイズワンサイズ寸法総丈 88cm ウエスト 60~cm 裏地丈 54cm 裏地裾幅 68cm ↑翌日到着ご希望の方は必ず御覧ください↑メール便可,https://item.rakuten.co.jp/kira-kira/jnb0060/,,1,https://thumbnail.image.rakuten.co.jp/@0_mall/kira-kira/cabinet/jnb/jnb0060-m.jpg?_ex=64x64,https://thumbnail.image.rakuten.co.jp/@0_mall/kira-kira/cabinet/jnb/jnb0060-m.jpg?_ex=64x64,https://thumbnail.image.rakuten.co.jp/@0_mall/kira-kira/cabinet/jnb/jnb0060-m.jpg?_ex=64x64,https://thumbnail.image.rakuten.co.jp/@0_mall/kira-kira/cabinet/jnb/jnb0060-m.jpg?_ex=128x128,https://thumbnail.image.rakuten.co.jp/@0_mall/kira-kira/cabinet/jnb/jnb0060-m.jpg?_ex=128x128,https://thumbnail.image.rakuten.co.jp/@0_mall/kira-kira/cabinet/jnb/jnb0060-m.jpg?_ex=128x128,1,0,0,1,0,0,,0,,,8.0,,,23,4.35,1,,,KiraKiraShop,kira-kira,https://www.rakuten.co.jp/kira-kira/,110734
18,0,【T-6】【宅配便A】【送料無料】バックスリット ハイネック ニット トップス レディース 長袖 オーバーサイズ 秋 冬【メール便NG】,バックスリット ハイネック ニット トップス レディース 長袖 オーバーサイズ 秋 冬,antelp:10004299,3090,参考サイズ：M着丈：(前身頃)62cm(後身頃)70cm肩幅：61cm身幅：61cm袖丈：44cm裾幅：54cm袖口：9.5cm裄丈：74cm素材：アクリル92% ナイロン7% ポリウレタン1%≪備考≫伸縮性：あり透け感：アイボリー若干あり生地の厚さ：やや厚手肌ざわり：ふっくらとした質感チクチクしない肌ざわりその他：柔らかい生産地：中国手洗い：可 ドライクリーニング：可ゆるっとしたオーバーサイズにバックスリットが映える♪旬のスタイリングに決まるおすすめニットが新登場です！締め付けすぎず、程よいユルさにこだわった暖かなハイネックは、リブ編みでざっくりとしたこなれ感を。背中部分のアウトリンキングでラインを加えることでスッキリとした印象に仕上げました。バックスリットで今年らしさも◎インナーにTシャツを重ねたレイヤードコーデはもちろん、バックスリットありでもそのままで着用できる長めの丈感も嬉しいポイントです。※撮影時のライティング、ご覧になっているモニター・PC環境により実際の商品と色味が異なって見える場合がございます。ご了承の上お買い求め下さい。モデル着用アイテム： パンツ※在庫切れ・販売終了・近日発売予定の商品はリンク切れしていることがございます。 モデル着用アイテム： パンツ※在庫切れ・販売終了・近日発売予定の商品はリンク切れしていることがございます。,https://item.rakuten.co.jp/antelp/6001572/,,1,https://thumbnail.image.rakuten.co.jp/@0_mall/antelp/cabinet/item10/14418574_0.jpg?_ex=64x64,https://thumbnail.image.rakuten.co.jp/@0_mall/antelp/cabinet/item10/14418574_0.jpg?_ex=64x64,https://thumbnail.image.rakuten.co.jp/@0_mall/antelp/cabinet/item10/14418574_0.jpg?_ex=64x64,https://thumbnail.image.rakuten.co.jp/@0_mall/antelp/cabinet/item10/14418574_0.jpg?_ex=128x128,https://thumbnail.image.rakuten.co.jp/@0_mall/antelp/cabinet/item10/14418574_0.jpg?_ex=128x128,https://thumbnail.image.rakuten.co.jp/@0_mall/antelp/cabinet/item10/14418574_0.jpg?_ex=128x128,1,0,0,1,1,0,,1,12:00,群馬県/埼玉県/千葉県/東京都/神奈川県/岐阜県/静岡県/愛知県/三重県/滋賀県/京都府/大阪府/兵庫県/奈良県/和歌山県/鳥取県/島根県/岡山県/広島県/山口県/徳島県/香川県/愛媛県/高知県,8.0,,,1,5.0,1,,,and Me（アンドミー）,antelp,https://www.rakuten.co.jp/antelp/,566028
19,0,【半額！11/29 10時〜24時間限定】2way アラン編み カシュクールニット トップス ニット セーター Vネック 長袖 レディース 大人 ウエストマーク 可愛い ローゲージ 2020秋冬新作 【lgww-at4256】【予約販売：12月17日入荷予定順次発送】【送料無料】宅込,2way アラン編み カシュクールニット トップス ニット セーター Vネック 長袖,sugarbiscuit:10129706,2480,"メールのご返信につきましてメールのご返信につきましては、ご連絡を頂戴してから3日(土日祝祭日を除く)以内にご返信させていただきます。なにとぞ、ご理解・ご協力のほどよろしくお願いいたします。【送料無料に関するご注意】北海道・沖縄県及び離島地域については別途送料がかかります。ご了承くださいませ。ITEMSPECカテゴリレディース > トップス > ニット/セーター実寸【フリー】バスト:108cm / 着丈:57-59cm / 袖丈:53cm / 肩幅:61cm素材アクリル52%,ナイロン28%,ポリエステル20%生産国中国カラーアイボリー、グレージュ、ブラウン、ブラック、ラベンダーご注意点■モニターの都合上、掲載写真と実際の色が異なる場合がございます。■サイズについて：※実寸は縫製時仕様（若干の誤差がある場合がございます）■素材の特性上、洗濯やクリーニング等で商品が縮んだりすることがあります。【ご注意】当店からのご注文お礼メール受信以前に関わらず当店では、注文確定後のキャンセル・内容変更等はお受けできません。よくご確認の上、ご注文ください。",https://item.rakuten.co.jp/sugarbiscuit/lgww-at4256/,,1,https://thumbnail.image.rakuten.co.jp/@0_mall/sugarbiscuit/cabinet/202010_1/lgww-at4256.jpg?_ex=64x64,https://thumbnail.image.rakuten.co.jp/@0_mall/sugarbiscuit/cabinet/202010_1/lgww-at4256.jpg?_ex=64x64,https://thumbnail.image.rakuten.co.jp/@0_mall/sugarbiscuit/cabinet/202010_1/lgww-at4256.jpg?_ex=64x64,https://thumbnail.image.rakuten.co.jp/@0_mall/sugarbiscuit/cabinet/202010_1/lgww-at4256.jpg?_ex=128x128,https://thumbnail.image.rakuten.co.jp/@0_mall/sugarbiscuit/cabinet/202010_1/lgww-at4256.jpg?_ex=128x128,https://thumbnail.image.rakuten.co.jp/@0_mall/sugarbiscuit/cabinet/202010_1/lgww-at4256.jpg?_ex=128x128,1,0,0,1,0,0,,0,,,8.0,,,8,4.5,1,,,SUGAR BISKET,sugarbiscuit,https://www.rakuten.co.jp/sugarbiscuit/,566028
20,0,11/29 10時〜24h超目玉 裏起毛パンツ ワイドパンツ ガウチョ ロング丈 フレアパンツ 暖か 裏起毛 無地 ウエストゴム パンツ ボトムス レディース ガウチョパンツ 2020 冬,裏起毛パンツ ワイドパンツ ガウチョ ロング丈 フレアパンツ 暖か,sunflower8:10004358,1480,"●配達日指定の出来る「宅配便」は3,980円以上で【送料無料】 ●沖縄・一部地域は別途料金 かかりますご了承ください。Size 実寸サイズ Mサイズ：着丈90cm/ウエスト36cm/前股上40cm/後股上49cm 　　　　　股下52cm/ヒップ66cm/わたり幅40cm/裾幅40cm Lサイズ：着丈92cm/ウエスト38cm/前股上42cm/後股上51m 　　　　　 股下54cm/ヒップ68cm/わたり幅41cm/裾幅41cm &nbsp; ※上記サイズは当店平置き実寸サイズです。サイズの詳細はこちらから。 素材 　綿・ポリエステル 裏地 　なし 生地の伸縮 　あり 透け感 　透けません カラー 全7色 ブラック/グレー/カーキ/ダークグレー/ネイビー/バーガンディー/テラコッタ （同じ商品でも生産時期により、カラー、形やサイズに多少の誤差が生じる場合もございます、あらかじめ御了承下さいませ。） 注意事項 ●生地の特性上、やや匂いが強く感じられるものもございます。 数日のご使用や陰干しなどで気になる匂いはほとんど感じられなくなります。 ●製品によっては、生地の特性上、縮む場合がございますので洗濯時はご注意下さいませ。 ●生地によっては摩擦（特に湿った状態）や、汗や雨などで濡れたときは他の衣類や下着に移染する場合がございます。 また淡色物に色移りする場合がございますので、お洗濯後はすみやかに（脱水、乾燥等）するようにお願いいたします。 ●商品写真はできる限り実物の色に近づけるよう加工しておりますが、お客様が使用するパソコンのモニター設定や部屋の照明により多少、色の変化が感じられる場合がございます。 ●機械による生産の為、生地の継ぎ目の若干のズレやほつれなど、形やサイズに多少の誤差が生じる場合がございます。 また、混紡繊維によって生地の織りに他繊維が混紡している場合がございます、 シミではありませんので、予め十分ご確認の上、ご注文頂きますようお願い申し上げます。 ●商品の特性上、生地の取り位置によりどうしても絵柄の出方・ニュアンスなど多少の個体差が生じ、 画像と表情が異なることがございます。また柄が縫い合わせ部分で必ずしも合っていないことがございます。 ●サイズ詳細等の測り方はスタッフ間で統一、徹底はしておりますが、 実寸は商品によって若干の誤差(3cm〜5cm )がある場合がございますので、予めご了承ください。 サイズについて詳しくはコチラ ! ●プリント生地の商品については、生地の裁断・縫製方法により写真と同様の柄が出ない場合がございます。 ●実際の色に近づけるため、タグのカラー名称と異なる場合がございます。 ●商品の性質上、次の商品は返品交換をお断りしております。 （※一部レギンス・スパッツ・水着） ※皆様により良い商品をより安くご提供させて頂けますよう、ご注文完了後のご交換・キャンセル・及び不良品以外のご返品・ご交換はお受け致しておりません。 お注文の際は、サイズ・カラー等よくご確認の上、ご注文くださいますようお願い申し上げます。",https://item.rakuten.co.jp/sunflower8/e-02-8102-1568/,,1,https://thumbnail.image.rakuten.co.jp/@0_mall/sunflower8/cabinet/item08/8102-1568-sum.jpg?_ex=64x64,https://thumbnail.image.rakuten.co.jp/@0_mall/sunflower8/cabinet/item08/8102-1568-sum.jpg?_ex=64x64,https://thumbnail.image.rakuten.co.jp/@0_mall/sunflower8/cabinet/item08/8102-1568-sum.jpg?_ex=64x64,https://thumbnail.image.rakuten.co.jp/@0_mall/sunflower8/cabinet/item08/8102-1568-sum.jpg?_ex=128x128,https://thumbnail.image.rakuten.co.jp/@0_mall/sunflower8/cabinet/item08/8102-1568-sum.jpg?_ex=128x128,https://thumbnail.image.rakuten.co.jp/@0_mall/sunflower8/cabinet/item08/8102-1568-sum.jpg?_ex=128x128,1,0,0,1,1,0,,0,,,8.0,2020-11-30 01:00,2021-12-10 14:59,36,3.81,1,,,Sunflower （サンフラワー）,sunflower8,https://www.rakuten.co.jp/sunflower8/,206440
