順位,キャリア,商品名,キャッチコピー,商品コード,商品価格,商品説明文,商品URL,アフィリエイトURL,商品画像有無フラグ,商品画像64x64URL(1),商品画像64x64URL(2),商品画像64x64URL(3),商品画像128x128URL(1),商品画像128x128URL(2),商品画像128x128URL(3),販売可能フラグ,消費税フラグ,送料フラグ,クレジットカード利用可能フラグ,ショップオブザイヤーフラグ,海外配送フラグ,海外配送対象地域,あす楽フラグ,あす楽〆時間,あす楽配送対象地域,アフィリエイト利用利率,販売開始時刻,販売終了時刻,レビュー件数,レビュー平均,商品別ポイント倍付け,商品別ポイント倍付け開始日時,商品別ポイント倍付け終了日時,店舗名,店舗コード,店舗URL,ジャンル情報
1,0,[Rakuten Fashion][2021新春福袋] nano・universe [WOMEN] nano・universe ナノユニバース その他 福袋【先行予約】*【送料無料】,【fukubukuro_nano_2020】nano・universe レディース その他 ナノユニバース,rfashion-luckybag:10001275,15000,　nano・universe（ナノユニバース）[2021新春福袋] nano・universe [WOMEN]■トータルコーディネートが完成！お得な5点セット■ 日頃の感謝の気持ちを込めた福袋が登場！アウターをはじめ、ワンピース、トップス、ボトムと、デイリーに活躍するアイテムが勢ぞろい！一つでスタイリングが完成するので、コーディネートに悩むことなく着ていただけます。オフィスにも似合うきれいめアイテムや、オフにも着まわせるカジュアルなアイテムなど、何が出るかはお楽しみ！ぜひ、この機会をお見逃しなく！ 【セット内容】 ・アウター 1点 ・ニット 1点 ・カットソー 1点 ・ワンピース 1点 ・スカート/パンツ(左記いずれか1点) 計5点 ◆nano・universe◆ ・3パターンの福袋に入った商品点数は全て同じです。 ・パターン1ーパターン3の中身の組み合わせはそれぞれ違います。 ・商品の内容に関するお問い合わせは一切お答えできませんので、予めご了承ください。 ・サイズはFREEとなります。サイズ交換はいたしかねますのでご了承ください。　　6691155001-360-F BZ3059【採寸】商品のサイズについて【商品詳細】※画面上と実物では多少色具合が異なって見える場合もございます。ご了承ください。 ■重要なお知らせ ※ 当店では、ギフト配送サービス及びラッピングサービスを行っておりません。ご注文者様とお届け先が違う場合でも、タグ（値札）付「納品書 兼 返品連絡票」同梱の状態でお送り致しますのでご了承ください。 ラッピング・ギフト配送について ※ 買い物カートに入れるだけでは在庫確保されませんのでお早めに購入手続きをしてください。当店では在庫を複数サイトで共有しているため、同時にご注文があった場合、売切れとなってしまう事がございます。お手数ですが、ご注文後に当店からお送りする「ご注文内容の確認メール」をご確認ください。 ご注文の確定について ※ Rakuten Fashionの商品ページに記載しているメーカー希望小売価格は、楽天市場「商品価格ナビ」に登録されている価格に準じています。 商品の価格について ■■■福袋ご購入前に必ずお読みください■■■ こちらはRakuten Fashion 2021新春福袋専用ストアです。Rakuten Fashion および Rakuten Fashion FLAGSHIP STORE の商品（2021新春福袋以外の商品）と同時購入はできません。 代引き決済はご利用できません。 ロッカー受け取り(楽天BOX受け取り)はご利用できません。,https://item.rakuten.co.jp/rfashion-luckybag/bz3059/,,1,https://thumbnail.image.rakuten.co.jp/@0_mall/rfashion-luckybag/cabinet/item/059/bz3059-01_1.jpg?_ex=64x64,https://thumbnail.image.rakuten.co.jp/@0_mall/rfashion-luckybag/cabinet/item/059/bz3059-01_1.jpg?_ex=64x64,https://thumbnail.image.rakuten.co.jp/@0_mall/rfashion-luckybag/cabinet/item/059/bz3059-01_1.jpg?_ex=64x64,https://thumbnail.image.rakuten.co.jp/@0_mall/rfashion-luckybag/cabinet/item/059/bz3059-01_1.jpg?_ex=128x128,https://thumbnail.image.rakuten.co.jp/@0_mall/rfashion-luckybag/cabinet/item/059/bz3059-01_1.jpg?_ex=128x128,https://thumbnail.image.rakuten.co.jp/@0_mall/rfashion-luckybag/cabinet/item/059/bz3059-01_1.jpg?_ex=128x128,1,0,0,1,0,0,,0,,,8.0,,,0,0.0,1,,,Rakuten Fashion Lucky Bag Store,rfashion-luckybag,https://www.rakuten.co.jp/rfashion-luckybag/,403911
2,0,クーポン利用で1890円裏起毛ハイネックトレーナー[予約販売：1月12日入荷予定順次発送] 裏起毛トレーナー スウェット 裏起毛 ハイネック トレーナー レイヤード 重ね着風,裏起毛ハイネックトレーナー 裏起毛トレーナー スウェット 裏起毛 ハイネック トレーナー レイヤード 重ね着風,3neco:10001051,3780,商品名 サイズ FREE カラー 素材 注意点 ●モニターの都合上、掲載写真と実際の色が異なる場合がございます。●仕様や素材は予告なしに変更することがございます。 ●これらの理由による返品、交換は受け付けておりませんのでご了承ください。【利用可能期間】12/06 12:59まで こちらの商品で使える半額クーポン配布中！ 商品名 ハイネックプルオーバー 素材 ポリエステル サイズ(cm) FREE 着丈：前67、後ろ：74　、バスト138−140cm モデル身長：155cm カラー ベージュ/カーキ/ブルー/バーガンディ/グレー/ブラック 注意点 ●撮影時のライティング、ご覧になっているスマートフォンのモニター・PC環境により実際の商品と素材感・色味が異なって見える場合がございます。 ●生地の特性上、やや匂いが強く感じられるものもございます。 ●機械による生産の為、生地の継ぎ目の若干のズレやほつれなど、形やサイズに多少の誤差が生じる場合がございます。また、混紡繊維によって生地の織りに他繊維が混紡している場合もございますが品質上の問題はございません。 ●サイズ詳細等の測り方はスタッフ間で統一、徹底はしておりますが、実寸は商品によって若干の誤差(3cm〜5cm )がある場合がございますので、予めご了承ください。 ●同じ商品でも“生産時期”や“カラー“により形やサイズに多少の“誤差“が生じる場合もございます。詳しくは商品画像や実寸サイズにてご確認くださいませ。 ●郵送時の厚みの関係で圧縮袋に入れた状態でお届けします。その際のしわ等は品質上問題ございません。 ●仕様や素材は予告なしに変更することがございます。 ●これらの理由による返品、交換は受け付けておりませんのでご了承ください。,https://item.rakuten.co.jp/3neco/les0019/,,1,https://thumbnail.image.rakuten.co.jp/@0_mall/3neco/cabinet/item06/tops0089_01.jpg?_ex=64x64,https://thumbnail.image.rakuten.co.jp/@0_mall/3neco/cabinet/item06/tops0089_01.jpg?_ex=64x64,https://thumbnail.image.rakuten.co.jp/@0_mall/3neco/cabinet/item06/tops0089_01.jpg?_ex=64x64,https://thumbnail.image.rakuten.co.jp/@0_mall/3neco/cabinet/item06/tops0089_01.jpg?_ex=128x128,https://thumbnail.image.rakuten.co.jp/@0_mall/3neco/cabinet/item06/tops0089_01.jpg?_ex=128x128,https://thumbnail.image.rakuten.co.jp/@0_mall/3neco/cabinet/item06/tops0089_01.jpg?_ex=128x128,1,0,0,1,0,0,,0,,,8.0,,,0,0.0,1,,,3neco楽天市場店,3neco,https://www.rakuten.co.jp/3neco/,403923
3,0,コート M/L/LL 日常に寄り添う、あたたかくってクセのないデザイン。 レディース ロングコート アウター ジャンパー ダウンジャケット ロング丈 大きいサイズ 防寒 ◆zootie（ズーティー）：サニーヒート フェイクダウンコート,じんわり。ぽかぽか。《SUNNY》なダウンコート。,e-zakkamania:10056503,5990,"商品番号：32566-1501170商品カテゴリ：【ベージュ】【ブラウン】【カーキ】【グリーン】【レッド】【パープル】【ネイビー】【ブラック】 肌色 グレージュ キャメル 茶 深緑 緑 赤 紫 紺 黒 レディース アウター コート ジャケット ジャンパー ジャンバー ダウン ダウンジャケット ダウンコート ダウンジャンパー ロングコート ロング丈コート ロング丈 ロング 襟 衿 長袖 長そで 大きい 大きいサイズ 大きめサイズ 大きめ ゆったり M Mサイズ L Lサイズ LL LLサイズ サイドポケット ポケット 中綿 撥水加工 撥水 はっ水 細見え 防寒 防寒対策 保温 ふわふわ もこもこ ふわもこ ふんわり あったか 暖かい 前開き フロントファスナー ファスナー フロントジッパー ジッパー 秋 冬 秋冬 秋服 秋物 冬服 冬物 新作 新着スウェットの上から着用しました。《M》着丈は膝の中心から7,8cm上、袖丈は手の甲がだいたい隠れるぐらいでした。全体的に程よく身体にフィットし、ダウンなのにスッキリしたシルエットです。《L》着丈は膝の中心から4,5cm上、袖丈は手の甲が隠れるぐらいです。Mサイズに比べ、身幅に余裕があります。中に厚手のニットを着込めそうですね。《LL》着丈は膝の中心から2,3cm上、袖丈は手の甲が隠れるぐらいです。身幅が余った感じで少し大きいです。私はスッキリシルエットのMサイズを選びます！中に着込みたい方はLサイズがおすすめです◎《M》着丈は膝の皿の上7cmくらいになりました。袖丈は手の甲2分の1くらいになりました。身幅は程よいゆとりがあります。《L》着丈はちょうど膝の皿の上くらいになりました。袖丈は手の甲2分の1くらいになりました。身幅はゆとりがあります。《LL》着丈はちょうど膝の皿の上くらいになりました。袖丈は手の甲2分の1くらいになりました。ゆとりがありLサイズよりも大きく感じました。自分に合ったサイズならMサイズですが、着込むならLサイズでも良いと思います。《M》着丈はお尻下5cm程。袖丈は手首の骨くらいでした。ぴったりとしたシルエットです。着心地も許容範囲内とはいえタイトで、袖丈が短いです。《L》着丈は膝上半分くらい、袖丈は手首がほぼ隠れるくらいでした。程よくタイトな着心地で、中に薄手のニットは着込めそうです。シルエットもシュッとしていてスタイリッシュ。密着度があるのでとても暖かく感じます。《LL》着丈は膝上2/3が隠れるくらい。袖丈は手の平に少しかかるくらいでした。Lサイズと比べると身幅・シルエットに余裕ができます。着膨れ感も全くなく、中に厚手のニットも仕込めそうでした◎中に着込まず、細身に着たいならLサイズを。少し余裕を持たせて着たいならLLサイズをオススメします。長袖カットソーの上から着用しました。《L》着丈はおしりが全部隠れ、袖丈は手首まででした。全体に中綿がしっかり入っているのでフロントのジッパーを閉めるとやや苦しく、腕周りもきつく感じます。厚手のものを着るとパツパツになってしまいます。前をあけるなら着れるかな？という感じです。《LL》着丈は股下5cm、袖丈は手の甲にややかかるくらいです。Lよりやや大きいためか、全体的に少しずつ余裕が生まれます。Lよりは腕周りに少しゆとりが出来たかなという感じです。前を開けて着るとゆとりがあります。ゆとりをもって着たり、中に厚手のものを着たいならLLサイズがオススメです。※【コンビニ受取対応商品】【はこぽす対応商品】日常に寄り添う、あたたかくってクセのないデザイン赤外線効果でぽかぽかあたたか。しっかり熱を閉じ込める中綿が詰まった、まさに岩盤浴のようなコート。当店オリジナルブランドzootie（ズーティー）のアイテムです♪毎日着ていただけるクセのないシルエットと厳選された色展開に、ご自宅で手洗い可能なのも、大切なポイント！身頃にはパネルラインが入れられスッキリとみせてくれ、2枚袖のお袖は動かしやすさを叶えます。ふっくらボリューム感のある襟は、寝かせても立たせてもOK。ドローコードをギュッと絞れば、しっかり冷気をシャットダウンします。生地の表面には撥水加工が施されています。あたたかさの秘密、中綿にあり！やや厚みを控えたすっきり着られるコートですが、赤外線効果のある中綿が詰められており、軽い着心地なのに着ると「じんわり」とぽかぽか。身体の熱や外部からの熱を逃がさず内に閉じ込めることで、あたたかさをキープします。インナージャケットM/LインナーロングコートM/LインナーロングベストFREEフェイクダウンベストM/L＞ まるで岩盤浴！蓄熱保温フェイクダウンシリーズはこちらからチェック表記サイズ《Mサイズ》《Lサイズ》《LLサイズ》※タグ記載のサイズです。スタッフの着用コメントを元にした当店のおすすめサイズはSTAFF VOICEをご覧ください。実寸《Mサイズ》総丈約85cm　胸囲約98cm　肩幅約37cm　袖丈約60cmアームホール約46cm　袖口約30cm　裾周り約120cm襟ぐりの幅約25cm　襟ぐりの深さ約9.5cm《Lサイズ》総丈約87cm　胸囲約105cm　肩幅約39cm　袖丈約61cmアームホール約49cm　袖口約30cm　裾周り約127cm襟ぐりの幅約25cm　襟ぐりの深さ約9.5cm《LLサイズ》総丈約89cm　胸囲約112cm　肩幅約41cm　袖丈約61cmアームホール約51cm　袖口約31cm　裾周り約134cm 襟ぐりの幅約25cm　襟ぐりの深さ約9.5cm※上記サイズは当店平置き実寸サイズです。商品タグ等の表記サイズ値（JIS規格ヌードサイズ）とは異なります。サイズの詳細はこちらから。素材本体：ポリエステル100％中綿：ポリエステル100％洗濯表示生産国中国製裏地ポリエステル100％生地の伸縮伸縮しません生地の透け感透けませんカラーグレージュ（アイボリーがかったベージュ）キャメル（明るく濃い柔らかなキャメル）カーキ（明るめのカーキ）レッド（明るく濃いレッド）パープル（明るく濃いパープル）ネイビー（やや明るめのネイビー）アッシュブラウン（暗めのブラウン）ブラック（標準的なブラック）関連商品●zootie（ズーティー）商品一覧●当店の ダウン商品一覧 ●当店の アウター商品一覧注意点▼ラッピングにはzootieセルフラッピングキット[LLサイズ]がオススメです。▼長時間濡れたままで重ねて置いたり、摩擦（特に湿った状態での摩擦）や、汗や雨などでぬれた時は他の衣料等に移染する場合がございますのでお気を付け下さいませ。また洗濯の際は移染する場合がございますので、他の物とは分けて洗って下さいませ。▼素材の特性上、洗濯やクリーニングにより多少縮んだり、斜行（商品全体がねじれて見える状態）が生じる事がございます。▼お取り扱い前に、商品付属タグの記載もご確認下さい。",https://item.rakuten.co.jp/e-zakkamania/32566-1501170/,,1,https://thumbnail.image.rakuten.co.jp/@0_mall/e-zakkamania/cabinet/15011/32566-1501170e.jpg?_ex=64x64,https://thumbnail.image.rakuten.co.jp/@0_mall/e-zakkamania/cabinet/15011/32566-1501170e.jpg?_ex=64x64,https://thumbnail.image.rakuten.co.jp/@0_mall/e-zakkamania/cabinet/15011/32566-1501170e.jpg?_ex=64x64,https://thumbnail.image.rakuten.co.jp/@0_mall/e-zakkamania/cabinet/15011/32566-1501170e.jpg?_ex=128x128,https://thumbnail.image.rakuten.co.jp/@0_mall/e-zakkamania/cabinet/15011/32566-1501170e.jpg?_ex=128x128,https://thumbnail.image.rakuten.co.jp/@0_mall/e-zakkamania/cabinet/15011/32566-1501170e.jpg?_ex=128x128,1,0,1,1,0,0,,0,,,8.0,,,1008,4.19,1,,,イーザッカマニアストアーズ,e-zakkamania,https://www.rakuten.co.jp/e-zakkamania/,555087
4,0,クーポン利用で1690円！ ＼大人気ブロガーAYAさん着用！／ 楽天総合1位 プリーツパンツ 秋冬 セルフカット レディース 9色 【新色追加】プリーツ パンツ ワイドパンツ 秋 冬 シフォン 大きいサイズ 裾カットOK ウエストゴム リラックスパンツ ボトムス メール便可//10//,SNSで話題騒然!!自分でお好みの長さに裾をカットできるパンツ！,kira-kira:10016921,2980,ディティール カラースペックSpec商品説明●全9色！アコーディオンプリーツルーズワイドパンツ ●大好評につき、待望の新色が登場しました！ ●楽ちんなのに”大人っぽくおしゃれ”に着られるプリーツパンツ。 ●ルーズ感が今年らしく、履くだけで着こなし上手に見せてくれるアイテムです。 ●立体的なヒダが特徴のアコーディオンプリーツ仕様。縦ラインがスタイリッシュな雰囲気をプラスし、リラクシーな中にも洗練さを演出します。 ●レッグラインを拾わないワイドシルエット。しなやかな生地と幅広フォルムのゆるさが心地よく、ノンストレスな着用感◎ ●ウエストは安定感のある平ゴム一周仕様。程よくフィットして楽ちん♪ ●身長やお好みの長さに合わせて裾カットOK！裾上げ不要で、切りっぱなしでもほつれないようになっています◎ ●冬はレギンスやタイツを着込んだスタイリングがおすすめ◎リラックス感のあるワイドフォルムなので、中に重ねてもシルエットに響かず洒落感をキープしたまま暖かく着用できます。 ●さり気ない光沢が上品なプリーツ生地。軽くしなやかな生地でリラックス感がありながら、上質な着こなしに演出してくれます。 ※MADE IN CHINA(中国製) 【裾カットについての注意事項】 ※サイドのシーム部分が、カットした部分から4-5mm程度解けてくる場合がございますが着用には問題ありませんのでご安心ください。 シーム部分から出ている糸はカットせずに結んでいただきますと、解けることなく着用が可能です。カラーグレージュ、レンガ、ブラウン、チャコール、ブラック、クリーム、キャメル、ダストパープル、ボルドー素材ポリエステル100％サイズワンサイズ寸法総丈 99（±3）cm ウエスト 62~cm ヒップ 94cm 渡り幅 29~cm 前股上 36cm 股下 68cm 裾幅 30~cm ↑翌日到着ご希望の方は必ず御覧ください↑メール便可,https://item.rakuten.co.jp/kira-kira/jnb0054/,,1,https://thumbnail.image.rakuten.co.jp/@0_mall/kira-kira/cabinet/jnb/jnb0054-m.jpg?_ex=64x64,https://thumbnail.image.rakuten.co.jp/@0_mall/kira-kira/cabinet/jnb/jnb0054-m.jpg?_ex=64x64,https://thumbnail.image.rakuten.co.jp/@0_mall/kira-kira/cabinet/jnb/jnb0054-m.jpg?_ex=64x64,https://thumbnail.image.rakuten.co.jp/@0_mall/kira-kira/cabinet/jnb/jnb0054-m.jpg?_ex=128x128,https://thumbnail.image.rakuten.co.jp/@0_mall/kira-kira/cabinet/jnb/jnb0054-m.jpg?_ex=128x128,https://thumbnail.image.rakuten.co.jp/@0_mall/kira-kira/cabinet/jnb/jnb0054-m.jpg?_ex=128x128,1,0,0,1,0,0,,0,,,8.0,,,731,4.12,1,,,KiraKiraShop,kira-kira,https://www.rakuten.co.jp/kira-kira/,206440
